id,url,expert_1,expert_2,platform,theme,value,value_item,value_item_alter,justification,clarification,opinion,violation_type,violation_type_alter,rating
83,https://github.com/flixel-gdx/flixel-gdx-box2d,Exp B,Exp X,Android+,Gaming & VR,Security,Reciprocation of Favors,,"The API documentation mentions the feature ""Collision usage in FlxBox2D"". While this feature is beneficial for the gameplay; it might lead to the violation of Reciprocation of Favors; as it might create an uneven playing field among the players due to variations in collision effects; thus preventing them from reciprocating assistance in competitive games.","In the API X context, the ""Collision usage in FlxBox2D"" feature, by allowing certain in-game elements to collide while others not, could potentially create an unfair advantage or disadvantage for some app users. This could contravene the value item ""Reciprocation of Favors"" under the parent value ""Security."" App users who are engaged in competitive games could perceive this variation in collision effects as a breach of fair play, thus hindering them from effectively returning or receiving assistance or 'favors' within the game. This undermines a key aspect of secure and fair engagement in a gaming ecosystem, where users should ideally have equal opportunities and not be disadvantaged by feature inconsistencies like varying collision effects.",Agreed-Clarified,Exploiting User Engagement Without Fair Returns,software security,Invalid
84,https://github.com/KingsMentor/Luhn,Exp C,Exp X,Android+,Security & Privacy,Achievement,Capable,,"The API documentation lists ""OTP (One-time password) verification"" as a feature but also mentions an ""OTP Length Bug fix"" in an updated version. This feature might breach the Capable value item if the API's OTP verification had issues interfering with the successful operation of the app; making it less capable.","The justification lies in the fact that ""API X"" is used in a mobile app for credit card entry and verification, where the one-time password (OTP) plays a critical role in ensuring the security and successful operation of the app. The documentation confirms the existence of an ""OTP Length Bug,"" indicating that the API may have previously failed in correctly handling or verifying OTPs of varying lengths, thus falling short in its function and violating the 'Capable' value item. As an 'App User,' this undermines the trust in the app's reliability and ability (or 'Capability') to securely handle sensitive credit card information and transactions, breaching the corresponding value of 'Achievement.'",Agreed-Clarified,Misleading Documentation,Security Affecting Operations,valid
85,https://github.com/KingsMentor/Luhn,Exp E,Exp Y,Android+,Security & Privacy,Security,Sense of Belonging,,While API focuses on secure credit card operations; there is no mention of features that enhance or contribute to the user's Sense of Belonging in any community or group; indirectly breaching this value.,"While using a mobile app that employs the 'API X,' an 'App User' may feel that their sense of belonging is indirectly violated. This violation is not due to a function or feature of 'API X', but rather the absence of features that express or integrate the user's affiliation with any community or group. For example, the API lacks features that aggregate users based on certain shared criteria to create a sense of community. Despite the seemingly secure nature for credit card operations, the absence of community-building features can lead to a perceived indirect violation of the value item ""sense of belonging"" under the value ""Security,"" from a user perspective. The clear evidence of this breach relies on the nonexistence of these features in the API's documentation provided.",Agreed-Justified,Induced Social Isolation,,Invalid
86,https://github.com/krzyzanowskim/CryptoSwift,Exp G,Exp Y,IOS+,Security & Privacy,Security,Healthy,,"The API documentation describes features like ""ECB (Electronic Codebook)"" and ""Rabbit"" for encryption and decryption. However; these outdated features could put users' data security at risk; breaching the value item 'Healthy' as it may adversely affect users' mental well-being due to fears over their data security.","While the API's documentation identifies the use of outdated cryptographic features such as ""ECB"" and ""Rabbit,"" these mechanisms have demonstrated vulnerabilities that could be exploited, compromising the encryption layer in applications that use this API. This breach directly impacts the 'Healthy' value item under the 'Security' value, as the confidentiality and integrity of the user's data are at risk due to potential malicious attacks exploiting these weaknesses. Such a scenario would directly contribute to an increased level of stress or anxiety, affecting the 'App User's' mental well-being due to fears for their privacy and data security. Consequently, the use of such outdated encryption features in a modern context presents a clear violation of the 'Healthy' value item.",Agreed-Clarified,Cryptographic Vulnerability Impact on Mental Health,,valid
87,https://github.com/sgl0v/SCrypto,Exp A,Exp Y,IOS+,Security & Privacy,Self Direction,Privacy,,"The API documentation describes the function ""Symmetric-key algorithms"" that allows encryption and decryption of user data. It does not specify if user consent is obtained before performing these actions. This breaches the value item ""Privacy"" under the value ""Self-Direction""; as users may not have the control to dictate who can or cannot access and handle their data.","Certainly, the key concern from a user's perspective regarding the use of symmetric-key encryption functionality mentioned in the 'API X' documentation is its potential to interfere with a user's privacy. Symmetric encryption is a method where a single key is used to both encrypt and decrypt the data. This means, when used within a mobile application, any data the user enters can be transformed into an unreadable format for transmitting securely, but also can be decrypted back into its original form. However, the documentation does not clarify whether this process would occur with the user's knowledge or consent. Thus, depending on how this function is implemented, without the user's consent, it potentially breaches the value item ""Privacy"" under ""Self-Direction"". It might interfere with a user's ability to dictate the access and handling of their personal data, thereby infringing on their right to privacy and self-directed control over their own information.",Agreed-Justified,Misuse of Personal Data,,valid
88,https://github.com/sgl0v/SCrypto,Exp B,Exp X,IOS+,Security & Privacy,Achievement,Successful,,"The API documentation describes several cryptographic operations which; while secure; require significant computational resources. The operation of these functions could impact the performance of the device and the overall success of the app from the user's perspective; thus breaching the value item ""Successful"" under the value ""Achievement"".","Apologies for the confusion earlier. The point I was trying to make is that the complex cryptographic operations, as mentioned in the 'API X' documentation, can consume extensive computational resources, including battery life and processing power of a user's device. This consumption might lead to slower device performance, draining of battery faster, and potentially compromising the smooth operation of other applications in the device. Thus, it directly contradicts with the 'Successful' value item under 'Achievement' as it may prevent app user from achieving his/her purpose of running other tasks effectively in that device because of the loss in performances caused by API X.",Agreed-Clarified,Lack of Incremental Success Indicators,,valid
89,https://github.com/sgl0v/SCrypto,Exp C,Exp X,IOS+,Security & Privacy,Security,Healthy,,"The API documentation describes the several cryptographic operations which can cause the mobile device to heat up and consume more battery when performing heavy computations; which might have negative impact on the physical health of the user. This breaches the value item ""Healthy"" under the value ""Security"".","I understand the initial confusion. My justification is based on how the features of 'API X', which includes multiple cryptographic operations, can indirectly harm an ""App User‚Äö√Ñ√∂‚àö√ë‚àö¬•s"" health from a mobile app perspective. High computational tasks like the cryptographic operations, especially when executed continuously or frequently, can overstrain a phone's processing capacity, leading to higher battery usage and potentially causing the device to heat up. Regular or prolonged exposure to this excess heat can potentially affect the user's comfort and physical health. While this might seem distant, it's intrinsically connected to the device's operation due the capabilities provided by the 'API X'. Therefore, this can represent a violation of the ""Healthy"" (v6.1) value item under the ""Security"" (v6) value from Schwartz's Taxonomy.",Agreed-Clarified,Thermal Risk from High-Computational APIs,,Invalid
90,https://github.com/codelynx/ShogibanKit,Exp D,Exp Y,IOS+,Gaming & VR,Stimulation,Excitement in Life,,"The documentation of API reveal that it doesn't support graphical user interface and AI functionality. This could have a negative impact on app user's ""Excitement in life""; a value item of Stimulation value type; since without an engaging user interface or intelligent responses; the user experience could be dull and monotonous.","The justification highlights that the lack of Graphical User Interface (GUI) and Artificial Intelligence (AI) support within API X implicitly limits the app's attractiveness and interactive capabilities. This can result in a mundane user experience that lacks novelty and excitement. The ""Excitement in Life"" value item of the Stimulation value type, within Schwartz's Taxonomy, fundamentally encompasses the desire for a stimulating and exciting life, filled with novelty and challenges. Therefore, by not offering visual appeal through GUI or challenge and unpredictability through AI, API X considerably limits the element of stimulation and excitement in an app user's experience, implicitly violating the ""Excitement in Life"" value item.",Agreed-Clarified,Lack of Engaging Content,,valid
91,https://github.com/codelynx/ShogibanKit,Exp E,Exp Y,IOS+,Gaming & VR,Achievement,Capable,,"API uses Japanese for coding and naming conventions. For non-Japanese players; this might be difficult to understand; which will affect users' ability to feel ""Capable""; a value item of Achievement value type. Not being able to understand the game fully could make them feel less accomplished.","The use of Japanese for coding and naming conventions in 'API X' may understandably create a barrier for non-Japanese speaking end users of the app. While developers might translate the interface, issues could arise with in-app features like error messages or notifications, potentially appearing in Japanese. This could lead to end users feeling less capable (undermining the value item of Being 'Capable') because they may struggle to interact seamlessly with the app or fully understand its functionalities, thereby impacting their perceived level of Achievement. This is not an assumption, but a likely scenario based on the explicit use of Japanese in the API, which directly influences the end user experience.",Agreed-Justified,Limited Accessibility,,valid
92,https://github.com/frozon/passbook,Exp A,Exp Y,IOS+,Wearable & IoT,Security,Healthy,,"Due to the complexity of the process for creating and maintaining digital passes; users might not find this application beneficial to their well-being; thereby violating the ""Healthy"" value item of the ""Security"" value. For instance; users could potentially experience stress and frustration in the process of using an application built on this API.","Sure, I understand the need for a clearer justification. In this case, the value item 'Healthy' from the 'Security' value in Schwartz's taxonomy is interpreted in the context of mental health, not physical health. The process for creating and maintaining digital passes through the API X could prove complex and confusing for the App User, as evidenced by the multiple steps, specific requirements and potential errors outlined in the documentation. This complexity may induce mental stress and anxiety for App Users, which are components that negatively affect one's mental health. Therefore, API X seems to breach the 'Healthy' value item as it potentially compromises the mental health (and thus the sense of security) of the App User as they navigate its complexities and potential issues.",Agreed-Clarified,Mental Health Impact by API Complexity,,Invalid
94,https://github.com/dbukowski/DBDebugToolkit,Exp C,Exp X,IOS+,Security & Privacy,Achievement,Successful,,"The API documentation describes the feature ""Crash reports"" that automatically sends reports when the application crashes. This could potentially breach the Successful value item as it might disrupt app users in their application usage and may impede their success in performing tasks within the app; leading to dissatisfaction and frustration.","The API's ""Crash reports"" feature is not merely a passive collection tool, but it also automatically sends these reports which could be deemed intrusive and a hindrance to the user experience. From an ""App User"" perspective, this could constitute a direct breach of the ""Successful"" value item under ""Achievement"", as the application's tendency to crash and the subsequent automated crash reporting may interrupt the completion of user's tasks, goals, or activities within the app. This continuous interruption and underperformance may hinder the user's sense of achievement and satisfaction with the app‚Äö√Ñ√∂‚àö√ë‚àö¬•s overall functionality, thereby contradicting the value item ""Successful"". The user's success is dependent upon uninterrupted, smooth app usage, which this feature inarguably disrupts.",Agreed-Justified,Insufficient Support for Success Metrics,,Unresolved
95,https://github.com/dbukowski/DBDebugToolkit,Exp E,Exp Y,IOS+,Security & Privacy,Security,Family Security,Software Security,"The API describes ""Sending console output by email with device and system information"". The console output might contain sensitive information. Sending this by mail breaches the Family Security value as it may expose personal data that might potentially compromise a user's personal or family security.","My justification is based on the fact that 'API X' presents a direct feature of ""Sending console output by email with device and system information."" This console output can potentially hold sensitive information related to the user's activities or app usage data. When this data is sent via email, it leaves the secure boundaries of the app and user's device, and travels through internet servers where it may be intercepted or fall into the wrong hands. This is a direct breach to the 'Family Security' value as it may lead to unauthorized access or misuse of the personal or family-related data, thus potentially compromising their security. Such a breach occurs regardless of the intention of the design or whether the user is aware of it. Since this feature is directly stated and not hypothetical, it shows a clear violation of the Family Security (v6.2) value item associated with the Security (v6) value in Schwartz's Taxonomy from the perspective of an 'App User'.",Agreed-Justified,Data Access Without Consent,,valid
96,https://github.com/vasilenkoigor/BiometricAuth,Exp G,Exp Y,IOS+,Security & Privacy,Self Direction,Privacy,,The feature that allows saving a feature list requiring authentication via TouchID means that identifiable biometric data might be unnecessarily exposed; collected; and perhaps stored. There is no mention in the documentation of how this data is secured; possibly violating the App User's Privacy under the value category Self Direction. The App User shouldn‚Äö√Ñ√∂‚àö√ë‚àö¬•t have to share private information unnecessarily or pass personal Privacy boundaries to use the app's functionalities.,"Sure, let me clarify. In simple terms, 'API X' has a feature that requires users to authenticate certain functionalities of a mobile application using their biometric data via TouchID (a type of personal, identifiable data). This data exposure happens each time users allow biometric authentication and it is not clear how this data is secured, stored or who has access to it. Thus, 'API X' could potentially violate the Privacy aspect of the 'App User's' Self-Direction value, as their biometric data may be exposed, potentially leading to identity theft, unauthorized use of personal information, or other breaches of privacy. The key point is that users are required to compromise their privacy in order to fully access and use certain features of the mobile application.",Agreed-Justified,Unauthorized Biometric Data Use,,valid
97,https://github.com/vasilenkoigor/BiometricAuth,Exp A,Exp Y,IOS+,Security & Privacy,Security,Family Security,Software Security,API's documentation indicates the potential for additional fingerprints to be added to the device for authentication purposes. However; it does not provide clarity on what happens when a family member's fingerprint is added; who may also use the same device but doesn't want their data to be used by the app. This feature could jeopardize Family Security under the value Security as it presents potential breaches in securing the family's biometric data from unauthorized access or misuse. The app user needs to secure their family's Privacy and maintain their device's Security features within the context of their family use.,"The potential breach of the value ""Family Security"" (v6.2) under the value ""Security"" (v6) by the ""API X"" lies in its biometric authentication feature that does not discriminate between fingerprints. Considering that several members of a family could use the same mobile device, the potential for one's biometric data (specifically, fingerprints) to be misused rises, particularly when the documentation does not provide safeguards or controls on whose fingerprints can be added. To an app user, this implies an insecure environment for their family's biometric data. This lack of specificity threatens the security of their family's privacy and poses a risk of unauthorized access or misuse, thereby directly contravening ""Family Security"" within the context of an app user's family device usage.",Agreed-Clarified,Invasion of Privacy,,valid
98,https://github.com/Kelin-Hong/MVVMLight,Exp B,Exp X,Android+,Development Essentials,Tradition,Respect for Tradition,,"The API documentation describes the feature ""global message broadcast"" that disregards user preferences and imposes global messaging functionality. This can breach the value item Respect for Tradition (v7.3) under the value Tradition (v7) as the traditional communication patterns respecting individual preferences and cultural norms may be overlooked or disrupted.","Sure, I'd be glad to further clarify. The feature ""global message broadcast"" in 'API X' enables the indiscriminate broadcasting of messages to all users regardless of their individual choices or preferences. This presents a direct breach of the value item Respect for Tradition (v7.3) because it doesn't respect established norms and conventions in communication. In traditional communication channels, a message is typically addressed to a specific recipient, respecting cultural norms and individual preferences. Those norms function to preserve social harmony and respect individuals' desired levels of engagement. This API strips away the selectivity in communication, which is at odds with tradition and established norms.",Agreed-Justified,Erosion of Traditional Skills,,Invalid
100,https://github.com/RobertApikyan/LifecycleMvp,Exp F,Exp X,Android+,Development Essentials,Security,Healthy,,"In the same vein; the handling of user data by the LifecycleMvp library without explicit mechanisms for controlling personal information may jeopardize users' health. This could arise from the stress of knowing their data is being handled with limited control over its manipulation. As such; this could be seen as a violation of the ""Healthy"" value item under the ""Security"" value.","I understand the concern. Here's my elaboration: The LifecycleMvp in 'API X' doesn't feature any settings or tools for end-users to manage their data, it's all foreground. Not having control over data can create stress and anxiety for some users as they might worry about possible misuse or exploitation of their information. This fear and stress are not conducive to a healthy mental state. Thus, this absence of explicit user data control in 'API X' can violate the 'Healthy' value item related to mental health under the value of 'Security' as it potentially compromises users' perceived sense of security around their data. This doesn't imply the API causes physical harm, but it underlines the mental aspect of health related to anxiety and stress from misuse of data.",Agreed-Justified,Anxiety from Inadequate Data Control,,valid
101,https://github.com/SysdataSpA/KTAndroidArchitecture,Exp A,Exp Y,Android+,Developer Productivity,Security,Sense of Belonging,,"In ""3.7 Testing"" part of the API documentation; it‚Äö√Ñ√∂‚àö√ë‚àö¬•s mentioned that; ""If you use the `safeExecute()` method call; whenever there's an error; it will fallback to an `InternalError` failure in case of an exception; saving you from an application crash."" However; this does not prevent or warn the user about the error; just preventing the app from crashing which can subsequently impact 'App User's' 'Sense of Belonging;' hence violating the value item 'Sense of Belonging' and its corresponding value 'Security.' They need to feel they are part of the interaction process with the mobile app; in which getting informed about an error or preventing one is a crucial factor.","The violation of the value item 'Sense of Belonging' and its corresponding value 'Security' stems from the potential inadequate user interaction this API feature promotes. The 'safeExecute()' function merely prevents the app from crashing without necessarily informing the user about an error event. This could limit the user's awareness and control over their interaction with the app, leaving them oblivious to potential issues. It may create an environment where the user feels detached or excluded from the communication loop within the mobile app, indirectly impacting their sense of belonging. Their security can also feel compromised as they're not informed about potential issues, hence not being able to take any preventive steps. This provides a clearer correlation between the 'API X' function and the violation of Schwartz's value item.",Agreed-Justified,Mental Health Impact by API Miscommunication,,valid
103,https://github.com/arturbosch/detekt,Exp E,Exp Y,Android+,Developer Productivity,Power,Preserving My Public Image,,"The API documentation states ""Code smell analysis for your [Kotlin](https://kotlinlang.org/) projects."" This violates the 'Preserving My Public Image' value item under 'Power'. As an 'App User'; the results of scanning the code could potentially affect the user experience of an app by triggering unwanted behaviors.","The 'API X' performs a code smell analysis of mobile applications, which could expose potential weaknesses or flaws in the codebase that may not necessarily impact the app's functionality but could reflect poorly on the organization that created it. When users of the mobile app learn about these code smells, there could be a perceived deterioration of the mobile app's reliability, and, by extension, the image of the organisation that created it. This is in violation of the 'Preserving My Public Image' value item under the 'Power' value, as the app users usually prefer to engage with apps presented by credible and reliable entities and might distance themselves from the app or its parent organization once such code smells become publicly known.",Agreed-Justified,Privacy Breach through Data Leakage,,Invalid
104,https://github.com/arturbosch/detekt,Exp F,Exp X,Android+,Developer Productivity,Security,Social Order,,"The API documentation mentions ""Highly configurable rule sets"". This may breach the 'Social Order' value item under 'Security'. If an app using this API allows for too much customization of rules without maintaining a base set of standardized rules; it might cause chaos and confusion for the end users; disturbing the established social order within the app‚Äö√Ñ√∂‚àö√ë‚àö¬•s community.","The user value item 'Social Order,' fitting under the broader value of 'Security,' emphasizes the importance of stability, harmony, and uniformity within a user's social environment. The ""Highly configurable rule sets"" capability of 'API X' may infringe on this value by allowing individual users the ability to significantly alter the rules of functionality or interaction within the app. Users developing their own set of rules may disturb the equilibrium of expectations and interactions within an app's community, leading to a perceived lack of social order and security. With diverse rule sets, the app's environment may become chaotic, unpredictable, or even prone to misuse, causing discomfort and insecurity among users who value a balanced and predictable social setting.",Agreed-Justified,Excessive Configuration Complexity,,valid
