id,url,expert_1,expert_2,platform,theme,value,value_item,value_item_alter,justification,clarification,opinion,violation_type,violation_type_alter,rating
249,https://github.com/Awalz/SwiftyCam,Exp F,Exp X,IOS+,Multimedia & Content,Conformity,Self-Discipline,,The 'SwiftyCam' documentation provides no evidence of providing features or mechanisms that encourage or support self-discipline. The ability to capture videos for an unlimited time; if set to '0.0'; potentially breaches the 'Self Discipline' value item of the value 'Conformity' as it gives users unlimited freedom without promoting or encouraging any form of constraints or discipline.,"Sure, let's delve deeper. The function 'takePhoto()' allows the user to take photos ad infinitum without any imposed limit on the number of photos taken. Similarly, 'startVideoRecording()' facilitates unlimited recording if 'maximumVideoDuration' is set to 0.0. These features directly contradict the value item 'Self-Discipline' under the value 'Conformity' as users may ""indulge"" themselves in excessive photo-taking or endless video recording without any forced restraint or discipline. The value 'Self-Discipline' in Schwartz's taxonomy refers to restraining one's behavior and not allowing indulgence in excessive actions. 'API X' by offering unlimited photo and video capture fails to uphold this value, thus resulting in a breach from an 'App User' perspective.",Agreed-Justified,User Data Collection Overreach,,valid
250,https://github.com/hyperoslo/Lightbox,Exp A,Exp Y,IOS+,Multimedia & Content,Self Direction,Privacy,,"The API feature ""paginated image slideshow"" may display personal photos without explicit user consent; potentially breaching the value item privacy under the value category ""Self Direction.""","Sure, I apologize if my initial justification was not clear. Looking closer at the ""paginated image slideshow"" feature of 'API X', this feature directly interacts with the user's media files, specifically images, to form a slideshow. In the context of a mobile app, typically, such features would require access to the user's media gallery. The potential breach of the value item ""Privacy"" (v1.6) under the ""Self Direction"" (v1) category comes into play if the app using 'API X' does not properly inform the user about the extent of the image access or does not obtain explicit consent before accessing or displaying personal images in the slideshow. This thereby intrudes on their privacy, which is a key component of ""Self Direction"".",Agreed-Justified,Privacy Data Handling Concern,,valid
252,https://github.com/poetmountain/PMTween,Exp D,Exp Y,IOS+,Multimedia & Content,Self Direction,Independent,,"The ""PMTweenUnit"" class in API handles all the actual property updating; suggesting that users have a limited ability to manage or influence those updates. This can be seen as an infringement on users' independence and thus; violate the value item Independent; associated with the value Self Direction.","In API X, the ""PMTweenUnit"" class automatically handles all the property updates without the involvement of the end users. It's inferred from this feature that users have no control over influencing these updates according to their preferences. As a result, the lack of user control can limit their independence in tailoring the app's interface and behaviors. This directly opposes the value item ""Independent"" that is part of the ""Self Direction"" value within Schwartz's Taxonomy, which refers to the freedom to cultivate and express one's individual abilities and ideas.",Agreed-Justified,Dependency Creation,,valid
253,https://github.com/poetmountain/PMTween,Exp E,Exp Y,IOS+,Multimedia & Content,Security,Sense of Belonging,,API does not provide any explicit feature or function to encourage or facilitate Sense of Belonging among users. Since all its features and functions; like additive tweens and property updates; are mostly self-contained and do not require or promote user collaboration or interaction; it can be reasoned that API violates the value item of Sense of Belonging and the corresponding value of Security.,"Certainly, to clarify, the value of Belonging and its corresponding value of Security that API X breaches speaks to a user's need for feeling included and having a sense of community when using an application. Looking at the API documentation, none of the features of API X seem to support or promote functionalities that involve, include or connect users to each other or a larger user network. Key aspects like user interactions, sharing, or collaborative features that could encourage this sense of connectedness and belongingness are clearly absent. Therefore, considering an end user perspective in a mobile application context, lacking these promoting elements in this API can be seen as contraventions towards creating an environment or experience that provides users with a sense of belonging and thus, security.",Agreed-Justified,User Alienation,,valid
254,https://developer.android.com/reference/android/animation/package-summary.html,Exp B,Exp X,Android,User Interface Design,Self Direction,Freedom,,The API provides a range of tools and functionalities to control animations in a mobile app. These control options; however; are in the hands of the app developers; not the end users. Thus; the potential for the mobile app to potentially limit the user's freedom to control certain visual aspects of the app does exist. This distinctly clashes with the value item Freedom; which recognizes an individual's ability to make independent choices and decisions. Nonetheless; this assertion is highly contingent upon how the developer chooses to use 'API' in their app and doesn't explicitly signify a direct breach of human values per the guidelines provided.,"While you're correct that this potential breach of the Freedom value depends on how the developer uses 'API X,' it's crucial to remember that we're analyzing from the App User's viewpoint. 'API X' offers developers, not the users, control over the application's animations. This potentially restricts the users' ability to customize their app experience according to their preferences. They have to conform to whatever visual aspects the developer has set. Here, it's not about if the developer will misuse this control but about the user not having this control at all. Consequently, the Freedom value, tying into the Self Direction value, which emphasizes decision-making autonomy, can be considered directly breached.",Agreed-Reconciled,Compulsory Update Enforcement,,valid
255,https://developer.android.com/reference/android/app/assist/package-summary.html,Exp C,Exp X,Android,Development Essentials,Self Direction,Privacy,,"The ""AssistContent"" class records information about the content the application user is viewing which potentially breaches the Privacy value as it may expose personal data and preferences without the user's explicit permission.","In the context of ""API X"", the ""AssistContent"" class is designed to hold information about the content an application user is viewing. This implies an active monitoring or tracking of the user's behavior and activity within the app which potentially infringes upon an end user's Privacy, which falls under the value category of Self Direction in Schwartz's taxonomy. Essentially, by recording and potentially exposing user's personal data and preferences without their explicit permission or without their total awareness, it's directly contravening the principle of privacy. Privacy in this context refers to the right to seclusion and the right to control one's own personal information, which is a critical aspect of an individual's autonomy and self-direction. Therefore, in the perspective of an end user, such feature poses a direct breach to their value of Privacy and Self Direction.",Agreed-Justified,Misuse of Personal Data,,valid
256,https://developer.android.com/reference/android/app/assist/package-summary.html,Exp D,Exp Y,Android,Development Essentials,Power,Preserving My Public Image,,"The ""AssistContent"" class presents the user's app usage data to an assistant; this could risk the Preserving My Public Image value as it could potentially reveal sensitive or embarrassing information that the user would prefer to keep private.","The ""AssistContent"" class is designed to hold and present the information about the content the app user has been viewing to an assistant at the user's request. The violation becomes evident when considering that the control over what information is shared as user's data and what is kept private, is no longer exclusively in the hands of the user. So, when an API feature exposes the user's activities in the app without any implied mechanism for the user to review, filter or restrict what can be shared, the user's ability to preserve their public image (v5.5), an aspect under the ""Power"" value, is compromised. Since, any information, which may consist of sensitive or highly personal user activities, hence subject to social judgement or discrimination, can inadvertently become public through the assistant without the user's full awareness or consent.",Agreed-Clarified,Privacy Breach through Data Leakage,,valid
258,https://developer.android.com/reference/android/app/usage/package-summary.html,Exp F,Exp X,Android,Data Management & Analysis,Security,Healthy,,The API provides various statistics such as network usage and storage statistics without considering the potential impact on users' well-being in terms of data consumption or device storage; potentially contravening the value item Healthy in the value Security by potentially jeopardizing the optimal performance of users' devices.,"The API X's feature of gathering detailed network and storage usage statistics without explicit user consent or control could compromise an App User's device by consuming excessive data or filling their device's storage. This has potential health implications for the user since a slowed or non-functional device might lead to stress and anxiety. Hence, this could breach the ""Healthy"" value item under the ""Security"" value, as it threatens the harmonious and stress-free interaction between the user and their device.",Agreed-Clarified,Network Dependency Risk,,valid
259,https://developer.android.com/reference/android/app/usage/package-summary.html,Exp G,Exp Y,Android,Data Management & Analysis,Self Direction,Independent,,API tracks and provides usage statistics including specific time ranges and events without users' explicit control or choice; potentially violating the value item Independent in the value Self Direction by not allowing users to opt out or control the tracking of usage statistics.,"The feature of 'API X' that I believe breaches the Schwartz's Taxonomy value item 'Independent' under the value 'Self Direction' is its ability to collect, store, and analyze usage statistics. This includes detailed information such as specific event types, network usage, and app usage over specific time ranges. These features give the app and, subsequently, its developers excessive control over the users' data with no clear mechanism for the user to limit, control, or opt-out of such data collection as stated in the API documentation. This directly contravenes the 'App User's' value of Independence which emphasizes making autonomous decisions and having control over personal matters. The potential for misuse of this data, privacy concerns, and the involuntary nature of the API's function makes it a prominent breach.",Agreed-Clarified,Data Use Without Consent,,valid
260,https://developer.android.com/reference/android/app/usage/package-summary.html,Exp A,Exp Y,Android,Data Management & Analysis,Universalism,Equality,,The classes NetworkStatsManager and UsageStatsManager provide device usage statistics and network usage history which may not be equally accessible to all users due to varying levels of technical adeptness. This could be seen as direct contravention of the value item Equality in the value Universalism; as it can lead to inequalities in understanding or controlling personal data usage.,"The 'API X' provides access to detailed device usage history and statistics through NetworkStatsManager and UsageStatsManager classes. From an 'App User' perspective, this means that the app has access to sensitive user data and metrics, like their app usage patterns and data usage history. Now, while the access to this information is not inherently problematic, an issue of inequality can arise depending on the transparency of the app about this data access and how users can control or limit it. If this information is not clearly communicated or complicated to control for users who are not technically adept, it creates an unequal situation where certain users may fall into inadvertent data pitfalls. This directly contravenes the value item 'Equality' under the value 'Universalism', as all users should have equal opportunity to understand and control their personal data use, regardless of technical expertise.",Agreed-Justified,Data Usage Inequality,,valid
262,https://developer.android.com/reference/androidx/biometric/package-summary.html,Exp C,Exp X,Android,Security & Privacy,Security,Healthy,Software Security,"The documentation for ""API"" features classes like ""BiometricPrompt.AuthenticationResult"" and ""BiometricPrompt.CryptoObject"" which could imply that in case of any software malfunction or breach; sensitive biometric data could potentially be exposed. This breaches the value item Healthy as the security of users' biometric data may not be assured.","The API X accesses and manages sensitive biometric data of the app user like fingerprints or facial recognition patterns to authenticate the user. Any malfunction or breach can lead to the exposure of this personal and sensitive data, which threatens the user‚Äö√Ñ√∂‚àö√ë‚àö¬•s security. The user‚Äö√Ñ√∂‚àö√ë‚àö¬•s health-related biometric data, which denotes ‚Äö√Ñ√∂‚àö√ë‚àö‚à´Healthy‚Äö√Ñ√∂‚àö√ë‚àöœÄ according to Schwartz's Taxonomy in the context of security value, can potentially be compromised. Therefore, the potential for exposure, misuse or mishandling of this biometric data, as implied by the API documentation, represents a direct contravention of the value item 'Healthy' under the 'Security' value from the user perspective.",Agreed-Justified,Biometric Data Misuse,,valid
263,https://developer.android.com/reference/androidx/biometric/package-summary.html,Exp D,Exp Y,Android,Security & Privacy,Universalism,Equality,,"The features of ""API"" like biometric prompts and authentication result classes may not be valid or accessible uniformly for all app users as not all users may have devices that support biometric features or may not be comfortable sharing their biometric data. This violates the value item Equality under Universalism as not all app users can uniformly access or take advantage of this functionality.","Certainly, let's elaborate. The value item 'Equality' under Universalism implies each individual having an equal chance in accessing and utilising features and opportunities. The 'API X, with its biometric features, raises an issue of inequality among users. Not everyone has a biometric-enabled device, and some may have disabilities or other personal reasons preventing them from using such features. Therefore, the 'API X' privileges certain users over others, thereby breaching the 'Equality' value item. It does not offer all users the same opportunity to use the app's functions, creating a sense of inequality between users who can and cannot use biometric authentication.",Agreed-Justified,Biometric and Security Inequality,,valid
264,https://developer.android.com/reference/androidx/loader/app/package-summary.html,Exp E,Exp Y,Android,Development Essentials,Self Direction,Privacy,,"The API documentation describes the feature ""manage user data"" that allows manipulation of user data without providing explicit mechanisms for controlling their personal information. This can breach the value item Privacy as it may expose users personal data.","Despite the lack of explicit reference to data privacy in the documentation, the feature of ""managing user data"" within 'API X' inherently suggests possible interference with user data, which includes personal information by default. This in its simplest sense infringes upon the user's Privacy. Without clear indications to the contrary, it is safe to assume the API doesn't provide sufficient measures for the user to control the collection, storage or processing of their data, which directly contradicts the value item 'Privacy' under 'Self-Direction'. The breach occurs as the user's freedom to direct and control his/her personal information is compromised, an essential aspect of Schwartz's 'Self-Direction' value.",Agreed-Justified,Misuse of Personal Data,,Unresolved
266,https://developer.android.com/reference/com/google/android/play/core/install/model/package-summary.html,Exp A,Exp Y,Android,Development Essentials,Self Direction,Freedom,,"Features such as ""UpdateAvailability"" and ""UpdatePrecondition"" can potentially limit the freedom of app users as it might force them to install updates which they might not prefer; thus breaching the 'Freedom' value item under 'Self Direction.'","Sure, the API X documentation states that it manages updates for the mobile application. In particular, the features ""UpdateAvailability"" and ""UpdatePrecondition"" imply a control over the update process of the app. This might result in situations where users are compelled to accept and install updates against their preferences for various reasons. Maybe they don't see a need for the update, it could consume a large amount of their data, or perhaps the update could change features in ways they don't want. This seems to intrude on the user's 'Freedom' to decide how they want their app to function and on their terms, a value item under 'Self Direction.' Thus, potentially limiting their ability to steer their actions independently and determine their own life direction. In this perspective, the API X seems to violate this value item from Schwartz's Taxonomy.",Agreed-Justified,Compulsory Update Enforcement,,valid
268,https://github.com/KingsMentor/medium-android-sdk-unofficial,Exp F,Exp X,Android+,Testing & Debugging,Power,Preserving My Public Image,,"The 'API' documentation mentions a number of features that involve ""clientIDs"" and ""clientSecrets"" for accessing Medium's API. These are sensitive details that if handled negligently; could jeopardize the online reputation of an 'App User'. The inability to protect these critical user details violates the value item ""Preserving My Public Image.""","The 'API X' documentation details features that explicitly use and transmit sensitive information like client IDs and client secrets. This information is fundamental to an 'App User's identity on Medium and its potential misuse could negatively impact the 'App User's privacy and public image. Suppose 'API X' is manipulated maliciously or mishandles this data due to a security flaw, it could lead to unauthorized access to the 'App User's Medium account leading to actions that are inconsistent with the 'App User's behavior. This could include posting inappropriate content or altering existing content - actions that can undermine the online image and social standing of the 'App User'. Therefore, by potentially putting the 'App User's public image at risk, 'API X' is in direct violation of the value item ""Preserving My Public Image"". It's important to note that this is not about developer misuse but rather about 'API X' inherent handling of sensitive user data from the 'App User' perspective.",Agreed-Clarified,Privacy Breach through Data Leakage,,valid
270,https://github.com/raycoarana/awex,Exp B,Exp X,Android+,Testing & Debugging,Stimulation,Excitement in Life,,"The API documentation contains the feature ""cancelTask;"" which provides the capability to terminate any running tasks abruptly. This negatively impacts the value item Excitement in Life under the value Stimulation. This might dampen the experiences of App Users as it could abruptly stop tasks that they find stimulating or exciting.","Certainly, here is further clarification. The API X‚Äö√Ñ√∂‚àö√ë‚àö¬•s ""cancelTask"" feature by design allows any ongoing tasks in an application to be prematurely terminated. For an App User engaged in a mobile app, this could translate into unexpected application behavior or abrupt cessation of activities that they find stimulating, entertaining or challenging - for instance, a game level failing to load, a video playback suddenly stopping, or a social media feed reset. Essentially, this interruption negates their expectations of consistent 'Excitement in Life' in the context of their app usage experience, a direct violation of the value of 'Stimulation' in Schwartz's Taxonomy. Consequently, the functionality of the API effectively hinders the fulfillment of this particular value for the App User.",Agreed-Clarified,Creativity Suppression,,Unresolved
271,https://github.com/rehmanmuradali/apk-analyzer,Exp E,Exp Y,Android+,Testing & Debugging,Power,Social Recognition,,"According to the ""API"" documentation; the API decompiles an Android apk and examines all security exposures; which could lead to the disclosure of users' personal data or information without their knowledge. Therefore; this API could breach the value item Social Recognition aligned with the value Power; as the unveiling of individual data may negatively influence the users' social standing or public reputation.","The API X is designed to expose potential security vulnerabilities within Android applications by decompiling these apps and examining their code, with a particular focus on identifying Hard-Coded Strings. From an app user‚Äö√Ñ√∂‚àö√ë‚àö¬•s perspective, should a piece of sensitive data such as a username, password, or other private detail be hard-coded into an app and thereby discovered, it could potentially be exploited without the user's consent. A user's private or sensitive information, once exposed, may lead to issues regarding their social recognition, as the dissemination or misuse of such information might impact their social standing, personal relationships, or image in the public sphere, and thus violate their value of Power as delineated in the Schwartz's Taxonomy.",Agreed-Clarified,Social Media Exposure Risk,,valid
272,https://github.com/rehmanmuradali/apk-analyzer,Exp F,Exp X,Android+,Testing & Debugging,Security,Healthy,,"The ""API"" documentation shows that this API decompiles Android apk while checking for all hard-coded strings; conceivably revealing critical information and potentially affecting user health in terms of their digital health and security. This breaches the value item Healthy under the value Security; as it leads to mental anxiety and stress due to potential data leakage.","Certainly, let me explain further. ""API X"" decompiles APKs to expose hard-coded strings. While the goal is to analyze possible vulnerabilities, from the perspective of an ""App User"", it directly threatens their digital health and safety that firmly underpins the value item 'Healthy' of 'Security' in Schwartz's Taxonomy. It exposes sensitive data like passwords or other proprietary information embedded in the software, potentially inviting unauthorized access or cyber threats. Thus, using an app that runs on this API could lead to persistent concerns about data privacy and safety, contributing to stress, anxiety, and overall mental insecurity. Hence, it is a direct breach of their 'Healthy' values within the broader 'Security' value.",Agreed-Justified,Privacy Breach Inducing User Stress,,valid
273,https://github.com/isacan/Andzu,Exp G,Exp Y,Android+,Testing & Debugging,Security,Healthy,Software Security,The 'Andzu' API collects various types of user data for debugging like logs; network requests. But the API documentation does not mention any security measures taken to protect these data. This lack of clarity raises concerns about the security of user data; which directly breaches the 'Healthy' value item under the value 'Security'.,"The ""Andzu"" API, as explicitly mentioned in its documentation, is designed to collect valuable data from user interactions such as logs, network information, and even crash reports. From an App user's perspective, this implies that their personal and potentially sensitive data is being logged and used by the application. While such data can be crucial for debugging and enhancing app performance, the absence of any explicit mention of data security measures or user data protection mechanisms in the API documentation is cause for concern. By potentially placing personal data at risk, 'API X' directly contravenes the user's 'Healthy' condition, which falls under the broader value of 'Security' in Schwartz's Taxonomy. This violation arises from the uncertainty and potential risks surrounding the user's personal data security during the app's debugging processes.",Agreed-Justified,App Stability Risk,,valid
