id,url,expert_1,expert_2,platform,theme,value,value_item,value_item_alter,justification,clarification,opinion,violation_type,violation_type_alter,rating
167,https://github.com/h6ah4i/android-openslmediaplayer,Exp F,Exp X,Android+,Multimedia & Content,Stimulation,Variation in Life,,The API documentation describes that OpenSLMediaPlayer consumes more CPU resources than other AudioTrack/OpenSL based audio player products. This can breach the value item Variation in Life as it limits mobile app user's opportunity to use other applications due to excessive CPU consumption by the OpenSLMediaPlayer.,"My justification is based on the given fact that 'API X,' or OpenSLMediaPlayer, is more demanding when it comes to CPU resources as compared to alternative media player products. As a consequence, for an end 'App User' on a mobile device, this can directly limit the amount of other applications they can simultaneously use or the variety of tasks they can perform on their device due to the excessive CPU usage of the OpenSLMediaPlayer. In this sense, the Stimulation value, specific to the Variation in Life value item within Schwartz's Taxonomy, is violated, as the mobile app user's ability to experience a diverse and flexible usage of their device is constrained.",Agreed-Justified,Monotony in Interaction,,valid
168,https://github.com/h6ah4i/android-openslmediaplayer,Exp G,Exp Y,Android+,Multimedia & Content,Security,Healthy,,The API documentation describes that OpenSLMediaPlayer consumes more CPU resources which could lead to excessive heating of mobile devices. This can breach the value item Healthy as it might affect the physical well-being of the mobile app user due to the potential hazard that excessive heating of devices presents.,"The value item Healthy is breached as the API documentation explicitly mentions that the OpenSLMediaPlayer consumes more processing power than its competitors, leading to higher CPU usage. As a result this could overheat the phone, making it uncomfortable or even dangerous to handle - particularly during prolonged use. This can compromise user safety, and thus directly jeopardize their health - violating the value item Healthy (v6.1) and by extension, its corresponding value Security (v6). Therefore the app user's physical well-being and security could be put at risk through the operation of this API in the mobile app.",Agreed-Justified,Thermal Risk from API Overload,,Invalid
169,https://github.com/wonderkiln/CameraKit-Android,Exp A,Exp Y,Android+,Multimedia & Content,Stimulation,Variation in Life,,"The API documentation indicates that it handles ""automatic system permission handling."" This could lead to a violation of ""Variation in Life"" as this feature removes the choice and control from the users over what permissions they might want to grant the app; thus; reducing variation in their interactive experience with the app.","The labeling of ""Variation in Life"" under ""Stimulation"" as a breached value is justified by the fact that 'API X's' feature of ""automatic system permission handling"" belittles the user's agency and autonomy in influencing their app experience. In conventional app-interactions, when an app needs certain permissions to function, it would often prompt users to grant these permissions, thus offering them a choice. By creating a variation in interactive experiences, this cognitive engagement stimulates the user. However, 'API X' automates these permissions, effectively removing this element of choice and thus, the variation in interactive experience, making the app's use less stimulating for the user. Therefore, the bridge between ""automatic system permission handling"" and the breaching of ‚Äö√Ñ√∂‚àö√ë‚àö‚à´Variation in Life‚Äö√Ñ√∂‚àö√ë‚àöœÄ under the value type ""Stimulation"" is evident in the context of an app user's perspective.",Agreed-Clarified,Barrier to User Engagement,,valid
170,https://github.com/wonderkiln/CameraKit-Android,Exp B,Exp X,Android+,Multimedia & Content,Self Direction,Privacy,,"The ""Automatic output cropping to match your `CameraView` bounds"" feature could infractly breach ""Privacy."" The automatic cropping might include parts of the image not intended by the user; exposing private information without their direct control or consent; and thus; could invade user's privacy.","The breach of the ""Privacy"" value item under ""Self Direction"" from an ""App User"" perspective is evident in the ""Automatic output cropping to match your `CameraView` bounds"" feature of 'API X'. This automated image cropping functionality could potentially lead to unintended exposures of private surroundings or activities in the user's vicinity which were inadvertently captured within the `CameraView` bounds but were neither seen nor intended to reveal by the user in the mobile app using this API. With this automatic cropping feature, the user loses direct control over what parts of their environment are included in the final image output, which could result in unsolicited exposure of their private spaces or situations. This feature directly contravenes the 'Privacy' aspect of the 'Self Direction' value as it undermines the user's control and consent over what is ultimately included in their images, posing a potential threat to their privacy.",Agreed-Clarified,Unauthorized Camera Access,,valid
171,https://github.com/wonderkiln/CameraKit-Android,Exp C,Exp X,Android+,Multimedia & Content,Self Direction,Independent,,"The ""Built-in tap to focus"" feature of API could infractly breach ""Independent."" The automatic adjustment could potentially override the user's choice of focus in the image or video; which could interfere with the user's independence to capture their preferred focus.","The feature ""Built-in tap to focus"" of API X, although designed to enhance the experience of app users, has the potential to limit their independence, a key item in the ""Self-Direction"" value on Schwartz's Taxonomy. The automatic adjustment of focus, initiated by a simple tap, takes control away from the users, not allowing them to manually adjust and select the focus of their images or videos according to their preferences. This constraint on the app user's control or agency in defining their own camera settings and photographing experience can be interpreted as a potential breach of ""Self-Direction"", which emphasizes the user's own goals, curiosity and independent decisions. This breach becomes more evident when we consider the implication of this feature in the context of a user who highly values their independence and complete control in their actions and decisions.",Agreed-Reconciled,Autonomy Constraint in Digital Interfaces,,valid
173,https://github.com/abhijith0505/ListView-Snapshot-Demo,Exp E,Exp Y,Android+,Multimedia & Content,Self Direction,Privacy,,The API documentation describes that this API will need the permission to write external storage. It can breach the value item Privacy by potentially affecting how the application could have access and manage users' phone storage creating a possible privacy intrusion.,"The feature of 'API X' that requires permission for external storage access infringes upon a user's Privacy (v1.6 under Self Direction (v1)) because it grants the mobile application a level of access to the user's device storage. This permission potentially allows the app to save, modify and even view user's personal data stored on the device, such as photos, documents and more. This intrusion essentially breaches the user's ability to maintain privacy and control over personal data and could lead to misuse or unauthorized sharing of stored data. This contradicts the value of Privacy that pertains to the right to keep personal spaces, activities, and information undisclosed, which falls under the broader value of Self Direction in Schwartz's Taxonomy.",Agreed-Justified,Misuse of Personal Data,,valid
174,https://github.com/arthur3486/ARVI,Exp A,Exp Y,Android+,Multimedia & Content,Self Direction,Privacy,,API's autoplay function for videos can also breach the value 'Self-Direction' and specifically the value item 'Privacy'. Autoplaying videos unexpectedly might contain sensitive or unwanted content; invading the privacy of the user's media consumption habits and personal space.,"The 'API X' documentation clearly states that it enables the 'autoplay' feature for video items in mobile applications. This feature breaches the 'Privacy' value item under 'Self Direction' because users, from the perspective of an end user, do not have control over what content is automatically played on their devices. They could be involuntarily exposed to content that they would otherwise choose not to engage with, and that could potentially compromise their sense of privacy and personal space. Therefore, the feature intrudes on the user's freedom of choice regarding their media consumption, violating their sense of privacy.",Agreed-Clarified,Privacy Data Handling Concern,,valid
175,https://github.com/arthur3486/ARVI,Exp B,Exp X,Android+,Multimedia & Content,Security,Social Order,,API's autoplay feature could potentially disturb the value of 'Security'. Specifically; the 'Social Order' value item; as autoplaying videos may disrupt the orderly and controlled environment users expect in their personal media consumption. This breach occurs as autoplay function can involuntarily expose users to new; potentially disruptive or inappropriate content.,"The autoplay feature detailed in the API X documentation breaches the 'Social Order' value item under 'Security', as it compromises the control that users typically have over the content they wish to view. Autoplaying videos inherently ensure that the sequence and selection of content is not entirely within the user's control, which could result in exposure to unwanted or unsuitable content. These automatic transitions from one video to another may disrupt the expected social order in a user's personally curated content feed, hence infringing upon their sense of security within their digital environment.",Agreed-Clarified,Intrusive Autoplay Implementation,,valid
176,https://github.com/gauravk95/audio-visualizer-android,Exp C,Exp X,Android+,Multimedia & Content,Self Direction,Independent,,"The API requires the ""android.permission.RECORD_AUDIO"" to visualize audio; without this permission the visualizer won't work. This can be considered a violation of the value Item ""Independent"" under the value ""Self Direction"" since the user is not free to utilize the app's features independently; without granting it invasive permissions.","In the context of mobile applications and 'API X,' the user's independence is tied to their ability to use an app's features freely without obligatory conditions. API X clearly states it requires 'android.permission.RECORD_AUDIO' for its operation, which an app user has to grant. This permission is invasive and deep-reaching, implying the user's personal environment might be continually accessed, recorded, and potentially stored. As such, a user can't independently use the app's features without satisfying this condition. They have to 'give up' a part of their privacy, hence explicitly affecting their degree of independence and violating the value item ""Independent"" under ""Self Direction.""",Agreed-Justified,Privacy Invasion and Compromised Autonomy,,valid
177,https://github.com/gauravk95/audio-visualizer-android,Exp E,Exp Y,Android+,Multimedia & Content,Security,Healthy,,"The API's attractive and engaging audio visualiser features can potentially lead to users using the mobile app for a longer duration of time without being aware of the potential health implications like auditory issues; hence violates the value item ""Healthy"" and its corresponding value ""Security"".","Noting the API's capabilities as an audio visualizer, prolonged exposure to excessive audio levels, which might be beyond a user's control in certain applications, has potential negative impacts on health like hearing loss or acoustic trauma. Even if the control of the volume lies in the mobile app, many consumers are unaware of the optimal noise levels and might unknowingly increase the volume to harmful levels. As a result, the user's health could be jeopardized, infringing upon the value item of ""Healthy"" under the ""Security"" value. The API documentation does not alert users or provide any protective measures against these potential health risks, hence the violation.",Agreed-Clarified,Audio Misuse,,Invalid
178,https://github.com/p32929/MyHouseAdsAndroid,Exp G,Exp Y,Android+,Multimedia & Content,Security,Family Security,,API also supports pushing interstitial ads when the user presses the back button. This could potentially disrupt the user's planned usage of the app; which might have been crucial for the user's family security; thus breaching the value item Family Security under the value of Security.,"The reason I considered Family Security under the value of Security as violated stems from the fact that the API's ability to generate disruptive ads at any time, especially during crucial functions like pressing the back button could possibly hinder important actions on a mobile app. For instances, if the ""App User"" is utilizing an app related to family safety (like a location tracker or emergency services app), such intrusive ads triggered through ""API X"" could potentially confuse, distract the user or cause delay; thereby compromising on the family's safety and security during critical times. So, in such situations, it's reasonable to argue that the API can directly breach an ""App User's"" value of Security, specifically their Family Security. However, it's worth mentioning that this is contextual and depends on the type of app the API is implemented in.",Agreed-Clarified,Adware Vulnerability,,Invalid
179,https://github.com/p32929/MyHouseAdsAndroid,Exp A,Exp Y,Android+,Multimedia & Content,Self Direction,Independent,,By allowing ads to be shown anywhere in the app including on button presses and back button presses; API restricts the user's freedom to operate the app functionalities without interference; violating the value item Independent under Self Direction.,"The value item 'Independent' under the value 'Self Direction' as listed in Schwartz's Taxonomy refers to the ability of an individual to act and think freely without external influences or interference. In the case of 'API X', the freedom to use and interact with the mobile app as per the user's choice is hindered, as the API allows ads to be displayed everywhere in the app. Even standard operation like pressing buttons triggers ads, thus forcing the user to engage with unwanted content, and essentially reducing their ease and freedom of app use. This restriction directly contravenes the user's 'Independence' within an app environment where ideally they should have the freedom to navigate and perform actions smoothly without forced interruptions, thus breaching the 'Self Direction' value.",Agreed-Clarified,Dependency Creation,,valid
180,https://github.com/fabian7593/MagicalCamera,Exp B,Exp X,Android+,Multimedia & Content,Universalism,Protecting the Environment,,"The API documentation for ""API"" describes the feature ""facial recognition"" that collects and processes user's facial data. This can breach the value item Protecting the Environment as it contributes to digital footprint and energy consumption. The consumption of energy and computational resources for processing and storing facial data is not in line with sustainable practices and preservation of the environment.","In response to your doubts, the violation of Protecting the Environment value happens as every process of gathering and processing facial data requires computational resources. This contributes to energy consumption and electronic waste as the lifespan of devices and servers is shortened due to this high processing demand. Hence, the more data the app processes (such as facial recognition data), the more it contributes to environmental degradation. Therefore, from an ""App User"" standpoint, using an app that continually collects and processes their facial data contributes to their digital footprint and indirectly impacts the environment, thereby crossing the Protecting the Environment value from the Universalism value category in Schwartz's Taxonomy.",Agreed-Clarified,Pollution Contribution,,Invalid
181,https://github.com/fabian7593/MagicalCamera,Exp C,Exp X,Android+,Multimedia & Content,Self Direction,Privacy,,"The API documentation implies that the ""API"" accesses user's photos without explicit consent or privacy controls. It could breach the value item Privacy under the value Self Direction; as it lacks adequate mechanisms for users to control their personal information; including their photos. Without clear privacy controls on user's photos and facial recognition data; it could be a potential violation of user's privacy rights.","The ""API X's"" documentation clearly states that it offers facial recognition features for photos, implying that it can access, analyze and store sensitive personal biometric data without any explicit declaration of obtaining user consent or implementing privacy controls. This direct access and utilization of personal biometric data, such as facial patterns, significantly infringes on an 'App User's' Privacy (v1.6), a value item under Self-Direction (v1). If users are not able to control who accesses, what is done with their personal biometric data, or how this data is stored and protected, then that is a clear and explicit breach of their privacy, compromising their ability for self-directed possession of personal information and fundamentally contravening their value of Self Direction.",Agreed-Justified,Unauthorized Biometric Data Use,,valid
183,https://github.com/Adnan865/MultiShapeBlurView,Exp E,Exp Y,Android+,Multimedia & Content,Self Direction,Privacy,,The API facilitates the blurring of user selected images; which may lead to them sharing far more intimate images (thinking they have obscured the content); leading to potential violation of Privacy. This breaches Self-direction as users may not have adequate control over their personal data when they use the features offered in this API.,"The 'API X' has the functionality to blur images in user selected shapes. However, the blurring process reduces the image size beforehand to increase the speed of blurring, meaning the details in a user's image could be lost. Additionally, the API does not provide explicit control for the user over the degree or extent of the blurring, leaving it to scale down images automatically before applying the blur. Thus, from the perspective of 'App User,' there could be a potential breach of 'Privacy' (v1.6) under the value of 'Self Direction' (v1), as users may unintentionally compromise detailed personal information believing they obscured them with this feature. The violation happens when an inadequate blurring might expose details that users intended to conceal, hence, reducing their control over their personal data.",Agreed-Justified,Misuse of Personal Data,,valid
184,https://github.com/zelin/ASCII-Art-Generator,Exp A,Exp Y,Android+,Multimedia & Content,Achievement,Capable,,According to the API documentation; ASCIIConverter potentially slows down the operation of the mobile application due to its potentially heavy and complex bitmap operation as indicated in the createASCIIImage and createASCIIString methods. This breach of performance aspects can negatively impact the user's perception of their capability in using the app efficiently causing a violation of 'Capable' value item which is under the 'Achievement' value in Schwartz's taxonomy. Without a key emphasis on performance optimization in the API; end users may find the mobile application less responsive; hindering their capability to achieve their desired outcomes.,"The ""API X"" uses complex bitmap operations to convert images into ASCII format, which can be computationally intensive, and potentially slow down the operation of the mobile application. From an ""App user"" perspective, this might lead to the app becoming less responsive or slower, hampering the user's ability to use the app efficiently and achieve their desired outcomes. This would violate the 'Capable' value item under 'Achievement' in Schwartz's taxonomy as it directly impacts the user's perceived capability and efficiency in using the app. It's important to note that although the developer can optimize the API usage to mitigate this slowdown, the end user doesn't have control over such optimizations. Therefore, from the user's perspective, this sort of violation of the 'Achievement' value may occur.",Agreed-Justified,Performance Degradation by Intensive Operations,,valid
185,https://github.com/kailash09dabhi/OmRecorder,Exp D,Exp Y,Android+,Multimedia & Content,Security,Healthy,Software Security,"The ""Permissions"" in API allows access to external storage and records audio; however; it does not provide any features to ensure that recorded data is secure and safe from any potential threats. Thus it breaches the ""Healthy"" value as it imposes a potential threat to the privacy and security of user's data.","In the context of a mobile app, the 'API X' documentation specifically mentions that the API has access to 'RECORD_AUDIO' and 'WRITE_EXTERNAL_STORAGE'. This potentially compromises the 'Healthy' value item under 'Security' of Schwartz's taxonomy for 'App Users'. This is because, in terms of digital wellbeing, 'Healthy' implies safety and lack of danger to personal privacy and data. The presence of recording and writing permissions without any explicitly stated security measure in API's documentation implies that this API can record audio at will and store it externally, potentially risking the user's privacy and data safety. Consequently, this open access to user's confidential information, might make the user prone to various undue security threats such as misuse of personal data, eavesdropping or unauthorized data access, which directly contravenes the 'Healthy' principle of feeling safe and secure.",Agreed-Clarified,Audio Misuse,Software Security Concern,valid
186,https://github.com/RamanuGen/gifex,Exp F,Exp X,Android+,Multimedia & Content,Achievement,Capable,,The 'API' documentation outlines that the 'App User' needs to get their own API key for accessing gifs. This might hinder the user from accessing the service swiftly and easily as it adds an additional layer of process to be completed; potentially limiting their capabilities (v4.2).,"The API documentation explicitly mentions the need for an 'App User' to get their own API key from either Giphy or Gifskey, outside sources for gifs, to use the gif loading and display feature in a mobile app. This extra task required by 'API X' can be seen as a direct violation of the 'Capable' value item under the 'Achievement' value from Schwartz's Taxonomy. This is because this necessity may pose an obstacle to the 'App User' who might not be technically savvy or familiar with how to obtain an API key, thus reducing their ability or capability to use this aspect of the mobile app seamlessly. In short, 'API X' potentially places a burden on the user to complete a task that not all users may be capable or competent enough to perform, undermining their 'Achievement' through 'Capability'.",Agreed-Justified,Usability Barrier by Requiring Third-Party Data,,valid
187,https://github.com/RedMadRobot/input-mask-ios,Exp B,Exp X,IOS+,Development Essentials,Achievement,Capable,,The API documentation specifies that the input masks enforce a rigid data entry format. This breaches the value item Capable in the value Achievement; as it restricts the ability of users to input data freely and may make users feel less confident and capable in providing their information without errors.,"Sure. In the context of user experience, particularly in data entry scenarios, the notion of capability extends to the user's ability to input data in a way they find intuitive and unrestricted. However, API X, through its input masking feature, imposes a strict data entry format. This enforced structure may hinder users who are accustomed to different data input formats or have specific preferences, thus making them feel less capable. When a user cannot input data as they see fit or are constrained by predefined formats, it's a direct breach on their perceived capability, which is a key value item under Schwartz's value of Achievement.",Agreed-Justified,Incomplete Feature Set,,valid
188,https://github.com/RedMadRobot/input-mask-ios,Exp C,Exp X,IOS+,Development Essentials,Security,Family Security,Software Security,The 'API' could potentially breach the value item Family Security under the value Security. It prescribes the use of specific data input formats without any mention of encryption or security measures to protect user data; which could put their family security at risk should that data be compromised.,"In the context of an ""App User,"" the API X's documentation makes it clear that it restricts and formats user's input in certain ways such as phone numbers, dates, card numbers etc., but it does not explicitly mention any data security or encryption measures for protecting this data. If a user was to input sensitive data - such as phone numbers or card details - into an app that uses this API, the lack of explicit data protection measures could expose this data to potential security risks, including data leaks or breaches. This directly contravenes the value item of ""Family Security"" under the value of ""Security,"" as the unauthorized exposure or misuse of such personal data could potentially jeopardize the user's and, by extension, their family's security.",Agreed-Clarified,Data Leakage,,valid
