id,url,expert_1,expert_2,platform,theme,value,value_item,value_item_alter,justification,clarification,opinion,violation_type,violation_type_alter,rating
2,https://developer.android.com/reference/android/hardware/biometrics/package-summary.html,Exp C,Exp X,Android,Security & Privacy,Security,Healthy,,The API documentation highlights that it uses biometric data; which is extremely personal and sensitive; to authenticate users. This may breach the Healthy value item under the Security value. Users may experience anxiety or stress about potential misuse of their biometric data; negatively impacting their mental health and overall well-being.,"The core of my justification lies in the inherent vulnerability associated with the use of biometric data. The documentation of 'API X' clearly indicates that it enables access to biometric utilities and manages biometric authentication, which means that highly sensitive user information - fingerprints, facial recognition data, etc. - could be at risk if the app or the system itself is compromised. The concern here is not just about the physical theft of such data, but also about the emotional and psychological toll it could potentially have on the user. The potential misuse, mishandling, or leakage of this data directly threatens users' sense of security, manifesting as stress or anxiety, which impinges on their well-being, hence breaching the 'Healthy' value item under 'Security' value from Schwartz's taxonomy. Hence, from an 'App User' perspective, 'API X' breaches the 'Healthy' value item considering its underlying implications on the users' mental health.",Agreed-Clarified,Biometric Data Misuse,,valid
4,https://developer.android.com/reference/android/media/midi/package-summary.html,Exp E,Exp Y,Android,Multimedia & Content,Achievement,Intelligent,,The API documentation reveals that the API does not provide any functionality allowing the end users to adapt; learn or develop their skills to handle the sophisticated MIDI devices and related scenarios effectively. This lack of user-friendly; adaptive learning or skill development feature potentially breaches the value item Intelligent; which is about the individual's ability to understand; learn; and adapt to their environment.,"Certainly, API X provides extensive functionalities related to MIDI devices. However, all these capabilities are inherently technical, and their effective utilization requires substantial MIDI knowledge, technical understanding, and expertise. An 'App User,' who is typically a non-technical individual, may find it challenging to interact with these MIDI functionalities, as the API does not provide any features catering to these non-technical users' learning needs to understand and adapt to these functions. It can inhibit the users' self-development opportunities and potential growth in handling MIDI oriented scenarios, suggesting a breach in the accomplishment of the Intelligent value item, a part of the Achievement value in Schwartz's taxonomy.",Agreed-Justified,Insufficient Intelligent Functionality,,valid
5,https://developer.android.com/reference/android/media/projection/package-summary.html,Exp F,Exp X,Android,Multimedia & Content,Self Direction,Privacy,,"The API documentation clearly states its ability to ""capture screen contents and/or record system audio"" without any explicit mentioning of user consent or the ability for the user to control this feature. This breaches the value item ""Privacy"" under the value ""Self Direction"" as it could potentially allow for the unauthorized extraction and use of users' private data or activities.","The API X affords an application the power to ""capture screen contents and/or record system audio,"" activities that are inherently intrusive and stray into the realm of a user's personal and private interactions with their device. This absence of explicit user consent or control directly infringes upon the ""Privacy"" value item of Schwartz's Taxonomy, which is part of the broader ""Self Direction"" value. The key point of contention here is that, without consent, a user's free will and autonomy, which are pillars of ""Self Direction,"" are subverted. By allowing recording and capture without clear boundaries or user controls, API X has the potential to expose or exploit intimate, private data, moments or interactions of the user with their device, thus violating the user's privacy.",Agreed-Justified,Unauthorized Media Capture,,valid
7,https://developer.android.com/reference/android/media/projection/package-summary.html,Exp A,Exp Y,Android,Multimedia & Content,Stimulation,Excitement in Life,,"The API's feature of screen capture and audio recording could lead to unexpected or sudden recording of system audio or screen content; which introduces an unpredictable component to the user's experience of the mobile app. This unpredictability infringes on the value item ""Excitement in Life"" under the value ""Stimulation;"" since it may deliver unwanted shock or surprise to the user; thus disturbing their regular or calm usage of the app.","The user's experience with a mobile application largely determines their overall interaction and how they perceive the application. In this context, the ""Excitement in Life"" value item under ""Stimulation"" signifies positive experiences like thrill, pleasure, and fun, which enrich the user's life. The ""API X"", however, offers functionalities that enable sudden and unexpected screen capture and system audio recording. These unexpected instances could interrupt the user's regular usage, leading to surprise or shock, which may be unpleasant. The unwanted intrusion and disruption to the user's interaction violate the ""Excitement in Life"" value item. This does not contribute positively to their life's stimulation but instead induces stress and discomfort, thus breaching the assumed sense of stability and control they might ordinarily associate with using the application.",Agreed-Clarified,Limitation of User Creativity,,valid
8,https://developer.android.com/reference/android/mtp/package-summary.html,Exp B,Exp X,Android,Multimedia & Content,Self Direction,Privacy,,The API can directly interact with connected cameras and other devices; receive notifications when devices are attached and removed; manage files and storage on those devices; and transfer files and metadata from the devices. This breaches the value item Privacy under Self Direction as it may compromise users' privacy by accessing and managing their personal files; also potentially transferring their personal data without providing any explicit user controls.,"The API's ability as outlined in the documentation raises privacy concerns from an ""App User"" perspective. It can interact directly with connected devices (which can include personal devices), receive notifications when devices are attached or removed, manage files and storage on those devices, and transfer files and metadata from the devices. This can include personal or sensitive information, such as photos or documents, that the user may not want to be accessed or managed by a third-party. Thus, as it stands, the API has the potential to breach the privacy of users by accessing, managing, and transferring their personal data, which opposes the value of ""Privacy"" under the ""Self-Direction"" category in Schwartz's Taxonomy of Values. The key issue is that these actions can potentially occur without users having explicit control or even awareness, further emphasizing the violation of user privacy.",Agreed-Justified,Misuse of Personal Data,,valid
9,https://developer.android.com/reference/android/mtp/package-summary.html,Exp C,Exp X,Android,Multimedia & Content,Achievement,Intelligent,,The API's ability to interact with and manage files in connected devices without the user's explicit understanding; given the technical nature of its operations; may violate Intelligence under Achievement; as the app user might lack the technical understanding needed to fully comprehend how their data and device are being used; potentially leading to less informed decisions regarding their data privacy and security.,"Sure, let me clarify. The value item 'Intelligent' under the 'Achievement' category in Schwartz's taxonomy refers to the user's ability to understand and make informed decisions. However, when using an app integrated with 'API X', the user's data and files might be interacted with or managed without their explicit understanding due to the API's technical nature and operations. This interaction might occur ""under the hood"" where the user is not entirely aware or does not fully comprehend, leaving room for potential misuse of their data. Consequently, they might feel their value of 'Intelligence' is violated as they don't have the required technical information to make an informed decision about their data privacy and security. The API‚Äö√Ñ√∂‚àö√ë‚àö¬•s functions in this case are directly breaching the user's ability to make informed decisions, hence violating their value of 'Intelligence'.",Agreed-Justified,Failure in Intelligent Data Interpretation,,valid
10,https://developer.android.com/reference/android/mtp/package-summary.html,Exp D,Exp Y,Android,Multimedia & Content,Security,Healthy,,The API has the ability to interact directly with connected devices; manage files; storage; and transfer files and metadata. This might compromise user's data security and potentially lead to the introduction of malicious entities onto the device if the API or the app using it is compromised; hence potentially breaching Healthy under Security; as users' electronic data security; a part of their overall well-being; could be jeopardized.,"In the context of a mobile app user, the 'API X' offers functionalities like interacting with connected devices and managing and transferring files and metadata. While these features are otherwise beneficial for seamless operation, they open up the risk of potential security breaches. If there's a vulnerability in the API or if the app using it is compromised, the API could be manipulated to transfer or manage files in an unintended, harmful manner. For instance, personal, sensitive data might be accessed or malware might be introduced, compromising the 'Health' of the device's information ecosystem. Essentially, this could infraract upon a user's 'Security', one of Schwartz's value items, as their electronic data privacy and protection, which is key for their overall well-being and trust in the digital context, could be at risk.",Agreed-Justified,Other Security Concern,,valid
11,https://developer.android.com/reference/android/net/http/package-summary.html,Exp E,Exp Y,Android,Connectivity & Networking,Self Direction,Privacy,,"The API documentation does not provide any features or functionalities that allow app users to control access to their data or limit how their data is used. This clearly breaches the value item ""Privacy"" under the value ""Self Direction""; as it does not explicitly guarantee the protection of user's private information.","The API X documentation details several features and functionalities related to data transfer and network communication, such as HttpEngine, UrlRequest, and UploadDataProvider, among others. However, there's no explicit mention of any functionality that encrypts user data, allows user consent before data sharing, or provides options for users to control how their data is used or shared. Hence, the API appears to lack privacy-related safeguards for the app users. This directly contravenes the value item ""Privacy"" - the right to control the access to one's personal information - under the value ""Self Direction"", on Schwartz's Taxonomy, from an App User's perspective. This break in privacy does not guarantee the protection of personal information, thereby violating the user's autonomy in directing his/her personal life, which is the central theme of the value ""Self Direction"".",Agreed-Justified,Insecure Network Communication,,Invalid
12,https://developer.android.com/reference/android/net/http/package-summary.html,Exp F,Exp X,Android,Connectivity & Networking,Achievement,Successful,,"API' features and functions do not seem to include provisions for app users to track their progress or achievements while using the app. This directly contravenes the value item ""Successful"" under the value ""Achievement""; as users do not have opportunities to succeed and accomplish their goals while using the app.","In ""API X"", there are no features or functionalities that allow users to measure or display their accomplishments or successes within the application. This breach is evident as the API documentation does not describe functions related to users' progress tracking, accomplishment badges, or rewards. Without such features, users are unable to tangibly realize their success or measure their progress in the app. This lack of achievement recognition feature can lead to a user's perception that their time and effort spent on the application are undervalued, undermining the Schwartz's value item ""Successful"" which falls under the ""Achievement"" category. It does not imply a system flaw but it suggests that this API might not be the best fit for applications where users' sense of Achievement is a core aspect.",Agreed-Justified,Lack of Incremental Success Indicators,,valid
13,https://developer.android.com/reference/android/os/strictmode/package-summary.html,Exp A,Exp Y,Android,Testing & Debugging,Achievement,Intelligent,,"The API documentation describes the feature ""NonSdkApiUsedViolation;"" which relates to the process accessing a non-SDK API. This may breach the value item ""Intelligent;"" a subcategory of ""Achievement;"" as it signifies that the mobile app may not operate optimally and smoothly for the App User; impacting their perception of the app's intelligence and efficiency.","Sure, in order to clarify my justification, I'm focusing on the 'NonSdkApiUsedViolation' feature in 'API X' that is used when a process accesses a non-SDK API. From an ""App User"" standpoint, it results in an application that may not function or operate effectively and can lead to app crashes or glitches. This suboptimal performance could lead the user to perceive the application, and by extension the developers, as lacking in intelligence or capability, effectively violating the 'Intelligent' value item. The 'Intelligent' value item refers to the belief that one should seek knowledge, clarity, and understanding, and should strive for a platform that works at its optimal level and, the ‚Äö√Ñ√∂‚àö√ë‚àö‚â§NonSdkApiUsedViolation‚Äö√Ñ√∂‚àö√ë‚àö¬• feature can inhibit this, thus violating the 'Achievement' value as the application falls short of its intended functionality. This clarity reduces the possibility for miscommunication or misunderstanding regarding the potential value breach.",Agreed-Clarified,Lack of Adaptive Learning Capabilities,Software Performance Reduction,valid
14,https://developer.android.com/reference/android/os/strictmode/package-summary.html,Exp B,Exp X,Android,Testing & Debugging,Security,Family Security,Software Security,"The API documentation mentions the feature ""CredentialProtectedWhileLockedViolation;"" which gets used when a process accesses filesystem paths stored in credential-protected storage areas while the user is locked. This breaches the value item ""Family Security;"" associated with ""Security;"" as the personal and sensitive data (which also could include family data) of the App User might be accessed or exposed when the user's device is locked; implying a risk to their security.","Apologies for any confusion. My rationale to label ""API X"" as breaching the value item ""Family Security"" under ""Security"" from an App User's perspective is because the API's stated violation ""CredentialProtectedWhileLockedViolation"" potentially disrupts an App User's sense of security. This violation occurs when a process accesses filesystem paths in credential-protected storage areas while the user's device is locked. Given that contemporary mobile usage frequently involves storing sensitive personal and even family-related data‚Äö√Ñ√∂‚àö√ë‚àö√Übe it family pictures, messages, banking details, or shared family services, any unauthorized ability to access these areas with the user's device locked hints a breach of trust and safety. This unauthorized access not only places the user's individual security at risk but can also affect family members whose information might be stored on the device. Thus, such a provision threatens to infringe upon an App User's ""Family Security"" from a broader perspective.",Agreed-Justified,Data Access Without Consent,,valid
16,https://developer.android.com/reference/android/text/method/package-summary.html,Exp E,Exp Y,Android,User Interface Design,Achievement,Successful,,The API documentation mentions TransformationMethods that replace password characters with dots; possibly preventing users from checking if they entered their passwords correctly. This feature may affect user's ability to successfully use the app; thereby potentially breaching the value item 'Successful.',"The 'API X' offers a feature where the characters of any password input are replaced with dots, as mentioned in the document under 'Transformation_Method'. This transformation restricts the users' ability to confirm if the password has been input correctly, which might lead to incorrect password inputs and repeated attempts to sign in. This potentially infringes upon the user's perceived notion of being 'Successful' (under the value 'Achievement') within the app, as their attempts to access the app is hindered, causing frustration and questioning their ability. Therefore, this feature breaches the 'Successful' value item by indirectly making the users feel less confident or capable.",Agreed-Justified,Insufficient Support for Success Metrics,,valid
17,https://developer.android.com/reference/android/text/method/package-summary.html,Exp F,Exp X,Android,User Interface Design,Security,Family Security,Software Security,The API documentation highlights how it modifies keypad input; which could potentially affect apps providing family control applications or parental controls. These features might risk the value item 'Family Security' as non-intended users could bypass restrictions set by the main user; risking family security policies dictated by the parental control policy of the app.,"Sure, I'd be happy to clarify. The 'API X' modifies keypad input and this has the potential to not only affect but compromise the integrity of apps providing family control applications or parental controls. This is because it might allow non-authorized users to tamper with or disengage parental restrictions, thereby breaching 'Family Security.' For instance, a child could potentially bypass internet content filters or app installation blocks their parents have put in place, knowingly or unknowingly accessing harmful or inappropriate content. This breach occurs because the API's keypad modification abilities could provide an avenue to subvert the intended practice of family protection within the app, directly challenging the 'Family Security' value item under the 'Security' value in Schwartz's Taxonomy.",Agreed-Justified,Risk of Data Tampering,,valid
18,https://developer.android.com/reference/android/view/textclassifier/package-summary.html,Exp G,Exp Y,Android,Development Essentials,Self Direction,Privacy,,API provides classes; such as TextClassifier; and features for identifying and handling classified text; which may potentially involve accessing and handling app user's personal communications without explicit consent. Therefore; it may violate the Privacy value; a value item of Self Direction; by not providing an adequate mechanism for controlling and securing users' private conversations and data.,"In the provided documentation of 'API X', there are strong indications of potential violations of user privacy and, by extension, self-direction. For instance, the API includes various interfaces and classes that are closely linked to text classification. In essence, this means it has the ability to analyze and classify text within user communications. Now, while this on its own isn‚Äö√Ñ√∂‚àö√ë‚àö¬•t necessarily concerning, the problem arises due to the API‚Äö√Ñ√∂‚àö√ë‚àö¬•s lack of clarity concerning user consent. The documentation fails to specify if these text classifications are performed with distinct user consent or not. If not, it may result in private user data being accessed, analyzed, and possibly even stored without explicit permission. Consequently, this could be seen as an infringement on a user‚Äö√Ñ√∂‚àö√ë‚àö¬•s ability to control their private data ‚Äö√Ñ√∂‚àö√ë‚àö¬® a key aspect of both the privacy value item and the broader self-direction value in Schwartz's taxonomy. Therefore, based on the documented features of the API, there is a reasonable argument to be made that these specific value items may potentially be violated from the perspective of an app user.",Agreed-Clarified,Privacy Data Handling Concern,,valid
19,https://developer.android.com/reference/android/view/textclassifier/package-summary.html,Exp A,Exp Y,Android,Development Essentials,Power,Preserving My Public Image,,API's features like TextClassifier and conversation actions could potentially manipulate users' data and conversations without explicit consent. The violation of user's control over their personal information and possible exposure of private conversations could damage the user's public image and reputation; thus; contravening the value item Preserving My Public Image under Power.,"Sure, let's delve deeper into why ""API X"" breaches the value item of Preserving My Public Image. The TextClassifier feature in ""API X"" understands and categorizes the content of the text data within the app. This means that private communication or personal information input into the app by the user, such as messages in a chat app, can be analyzed, categorized and potentially manipulated. The ConversationAction feature can suggest responses within a conversation, hence these suggestions could potentially alter the user's intended message or even divulge sensitive information. These functions violate a user's control over their personal data and may expose private conversations. Such potential exposure directly breaches the value of Preserving My Public Image, as the unintended disclosure of personal information could lead to misunderstandings, misconceptions and can detrimentally affect a user's reputation and public image.",Agreed-Justified,Misuse of Personal Communication,,valid
20,https://developer.android.com/reference/javax/security/auth/callback/package-summary.html,Exp B,Exp X,Android,Security & Privacy,Power,Preserving My Public Image,Authority,The API documentation discusses retrieving specific authentication data and displaying certain information; such as error and warning messages. This could potentially expose the app user to unwanted or malicious activities; breaching the value item Preserving My Public Image (Value Item v5.5 under Power); by putting the user's online reputation and public image at risk.,"The ""API X"" has access and control over retrieving sensitive authentication details, such as usernames and passwords from the users. This data access is likely to be invisible to the user, thus potentially compromising their privacy and security. Through the API, there can also be error or warning messages displayed, which could contain user's sensitive data and might be seen by others. In a society where image is closely tied to digital identity, having one's private login details exposed can harm their public image. This can result in a direct infringement of the value item, 'Preserving My Public Image' (v5.5) under the 'Power' value (v5), because it takes away the app user's control over their own digital identity and security. Therefore, the given API, without clear user consent or transparency measures, seems to directly contravene this value item from the user's perspective.
",Agreed-Clarified,Privacy Breach through Data Leakage,,valid
